<?xml version="1.0" encoding="UTF-8" standalone="yes"?><ns2:carShowroom xmlns:ns2="http://www.przyklad.pl/showroom" xmlns:xsi="http://www.w3.org/2001/XMLSchema-instance" xsi:noNamespaceSchemaLocation="Showroom.xsd"><brands><brand id="jaguar"><name>Jaguar</name><country continent="Europe">UK</country><headquarters>Coventry, UK</headquarters><chairman>Ralf Speth</chairman></brand><brand id="renault"><name>Renault</name><country continent="Europe">France</country><headquarters>Boulogne-Billancourt, France</headquarters><chairman>Thierry Bolloré</chairman></brand><brand id="jeep"><name>Jeep</name><country continent="North_America">U.S.</country><headquarters>Toledo, Ohio, U.S.</headquarters><chairman>Michael Manley</chairman></brand><brand id="landRover"><name>Land Rover</name><country continent="Europe">UK</country><headquarters>Coventry, UK</headquarters><chairman>Ralf Speth</chairman></brand></brands><cars><car id="c21" brandId="renault"><model version="IV">Megane</model><type doors="5" seats="5">compact</type><production start="2016">2016</production><engine fuel="Petrol"><cylindersNumber>4</cylindersNumber><capacity>1200</capacity><power>101</power></engine><wheeldrive automatic="n">front-wheel</wheeldrive><condition accidentfree="y" mileage="346000 km">used</condition><lacquer>white</lacquer><price currency="PLN">27999</price></car><car id="c22" brandId="landRover"><model version="setVersion">setModel</model><type doors="5" seats="5">setType</type><production start="2019">2019</production><engine><cylindersNumber>10</cylindersNumber><capacity>100</capacity><power>10</power></engine><wheeldrive automatic="n">setCarWheeldrive</wheeldrive><condition accidentfree="y" mileage="cerConditionMileage">setCondition</condition><lacquer>setCarLacquer</lacquer><price currency="$">1000</price></car></cars><metadata><comment>Programowanie komunikacji komputer-człowiek. Zadanie 1.</comment><author index="210198">Jędrzej Hasiura</author><author index="210332">Patrycja Szczakowska</author><modificationDate>2019-03-19</modificationDate></metadata></ns2:carShowroom>